{
  "$schema": "https://json-schema.org/draft/2020-12/schema",
  "$id": "urn:ethos:schema:crop-element-surface-shape-contract:1",
  "title": "Ethos crop_element_surface_shape v1 contract inventory",
  "description": "Contract inventory for the crop_element callable surface shape. This validates inventory shape and vocabulary; CLI and non-CLI surface alignment stays in the repository guard.",
  "type": "object",
  "required": [
    "schema_version",
    "contract",
    "status",
    "carrier",
    "request_schema",
    "descriptor_schema",
    "base_contract_inventory",
    "planned_surface_fields",
    "current_surface",
    "explicit_blockers"
  ],
  "additionalProperties": false,
  "properties": {
    "schema_version": { "const": 1 },
    "contract": { "const": "crop_element_surface_shape.v1" },
    "status": { "const": "supported" },
    "carrier": { "const": "source-only crop_element surface shape" },
    "request_schema": { "$ref": "#/$defs/repo_path" },
    "descriptor_schema": { "$ref": "#/$defs/repo_path" },
    "base_contract_inventory": { "$ref": "#/$defs/repo_path" },
    "planned_surface_fields": {
      "type": "array",
      "minItems": 1,
      "items": { "$ref": "#/$defs/surface_field" }
    },
    "current_surface": {
      "type": "object",
      "required": [
        "cli_command",
        "cli_mode",
        "python_method",
        "python_status",
        "checked_files",
        "cli_tests",
        "python_tests"
      ],
      "additionalProperties": false,
      "properties": {
        "cli_command": { "const": "crop_element" },
        "cli_mode": { "const": "descriptor_and_rendered" },
        "python_method": { "const": "crop_element" },
        "python_status": { "const": "descriptor_and_rendered" },
        "checked_files": {
          "type": "array",
          "minItems": 1,
          "items": { "$ref": "#/$defs/repo_path" },
          "uniqueItems": true
        },
        "cli_tests": {
          "type": "array",
          "minItems": 1,
          "items": {
            "enum": [
              "crop_element_cli_writes_descriptor",
              "crop_element_cli_fails_closed_on_invalid_check_id",
              "crop_element_cli_rendered_request_requires_source_pdf_and_crop_dir",
              "crop_element_cli_rendered_source_pdf_must_match_document_source",
              "crop_element_cli_writes_rendered_artifacts_when_pdfium_is_configured"
            ]
          },
          "uniqueItems": true
        },
        "python_tests": {
          "type": "array",
          "minItems": 1,
          "items": {
            "enum": [
              "test_crop_element_invokes_descriptor_cli_with_request_and_check_id",
              "test_crop_element_method_uses_default_check_id",
              "test_crop_element_rejects_empty_check_id_before_command_execution",
              "test_crop_element_missing_request_raises_file_not_found",
              "test_crop_element_invalid_json_stdout_raises_output_error",
              "test_crop_element_passes_rendered_artifact_arguments",
              "test_crop_element_rejects_partial_rendered_arguments"
            ]
          },
          "uniqueItems": true
        }
      }
    },
    "explicit_blockers": {
      "type": "array",
      "minItems": 1,
      "items": { "type": "string", "minLength": 1 },
      "uniqueItems": true
    }
  },
  "$defs": {
    "surface_field": {
      "type": "object",
      "required": ["name", "maps_to"],
      "oneOf": [
        { "required": ["required"] },
        { "required": ["required_when"] }
      ],
      "additionalProperties": false,
      "properties": {
        "name": {
          "enum": [
            "document_fingerprint",
            "element_id",
            "rendering",
            "source_pdf_fingerprint",
            "crop_descriptor",
            "rendered_artifact"
          ]
        },
        "maps_to": {
          "enum": [
            "request.document_fingerprint",
            "request.element_id",
            "request.rendering",
            "request.source_pdf_fingerprint",
            "descriptor.crop_ref",
            "descriptor.rendered_ref"
          ]
        },
        "required": { "type": "boolean" },
        "required_when": { "const": "rendering=rendered" }
      }
    },
    "repo_path": { "type": "string", "minLength": 1, "pattern": "^[A-Za-z0-9_./-]+$" }
  }
}
